<?xml version="1.0" encoding="UTF-8"?>
<xmlnyugtacreate xmlns="http://www.szamlazz.hu/xmlnyugtacreate"
                 xmlns:xsi="http://www.w3.org/2001/XMLSchema-instance"
                 xsi:schemaLocation="https://www.szamlazz.hu/szamla/docs/xsds/nyugtacreate/xmlnyugtacreate.xsd">
   <beallitasok>
      <szamlaagentkulcs>97039xbwy2gws4iv7yn4xk8cniuird56tyamat6gy3</szamlaagentkulcs>
      <pdfLetoltes>false</pdfLetoltes>
   </beallitasok>
   <fejlec>
      <hivasAzonosito></hivasAzonosito>
      <elotag>LA91E</elotag>
      <fizmod>készpénz</fizmod>
      <penznem>Ft</penznem>
   </fejlec>
   <tetelek>
      <tetel>
         <megnevezes>Kitten doormat</megnevezes>
         <mennyiseg>2.0</mennyiseg>
         <mennyisegiEgyseg>db</mennyisegiEgyseg>
         <nettoEgysegar>10000</nettoEgysegar>
         <afakulcs>27</afakulcs>
         <netto>20000.0</netto>
         <afa>5400.0</afa>
         <brutto>25400.0</brutto>
         <fokonyv>
            <arbevetel>...</arbevetel>
            <afa>...</afa>
         </fokonyv>
      </tetel>
      <tetel>
         <megnevezes>Puppy doormat</megnevezes>
         <mennyiseg>2.0</mennyiseg>
         <mennyisegiEgyseg>db</mennyisegiEgyseg>
         <nettoEgysegar>10000</nettoEgysegar>
         <netto>20000.0</netto>
         <afakulcs>27</afakulcs>
         <afa>5400.0</afa>
         <brutto>25400.0</brutto>
      </tetel>
   </tetelek>
   <kifizetesek>
      <kifizetes>
         <fizetoeszkoz>voucher</fizetoeszkoz>
         <osszeg>30000.0</osszeg>
         <leiras>OTP SZÉP kártya</leiras>
      </kifizetes>
      <kifizetes>
         <fizetoeszkoz>debit card</fizetoeszkoz>
         <osszeg>20800.0</osszeg>
      </kifizetes>
   </kifizetesek>
</xmlnyugtacreate>
